,title,subreddit,selftext
1811,YSK about the story of Inês de Castro.,YouShouldKnow,[removed]
1812,Ysk My balls gave starting to hurt wearing boxers in my 30's :(,YouShouldKnow,[removed]
1813,YSK: Your bad review could get someone fired.,YouShouldKnow,"Why YSK: Take a second to ask yourself whether your experience was worth putting someone else's livelihood in jeopardy. I've been in management for a while and had to play interception between owners and employees when the company gets a bad review for the smallest thing. Even if you have a bad experience, is it worth getting someone fired over?"
1814,YSK: Leaving a bad review could get someone fired.,YouShouldKnow,[removed]
1815,YSK that medical students are routinely invited to practice pelvic exams on women who are unconscious during surgery.,YouShouldKnow,Why YSK: It’s a very *common practice* in teaching hospitals in almost every state in the US. The claim is that allowing medical students to perform pelvic exams on unconscious women in the operating room enables them to be well trained by the time they go into practice. [This article](https://www.ncbi.nlm.nih.gov/pmc/articles/PMC6882529/) explains it.
1816,YSK that medical students are routinely invited to practice pelvic exams on women who are unconscious during surgery.,YouShouldKnow,[removed]
1817,YSK Most wheelchair users CAN walk. There's many valid reasons to use wheelchairs.,YouShouldKnow,"Why YSK: There are many reasons and disabilities which may not be visible that may cause someone to need or prefer to use a wheelchair. 

Reasons can include but are not limited to:
1-Heart Conditions- These can cause someone to faint or pass out from standing or walking for long periods of time. Passing out can lead to injuries.
2-Extreme hypermobility- in which joints such as ankles, knees, hips, etc. dislocate very easily and cause severe issues. 
3- Recovery- Someone might be recovering from surgery or an injury that isn't necessarily visible. Crutches can be harmful to your arms if used for too long, they also prevent you from being able to hold pretty much anything.
4- Comfort- Whether it be because of weight, a non visible health condition/disability, injury, surgery, etc. This person chose to be safe. Wheelchairs are not convenient to use without a need. If someone chose that this is important, whether it be temporary or permanent, this choice should be respected."
1818,YSK : When you and a potential partner get a standard STI/STD blood test panel it doesn't include every incurable disease.,YouShouldKnow,[removed]
1819,YSK IJFUHBUGNJMHNHJGTMBITYNBTKGNBHT6MIBUNTIGNBUTGMBIBTBMUGMBIJBG,YouShouldKnow,[removed]
1820,YSK your city’s grid system and how to find an address without GPS,YouShouldKnow,"Why YSK: Even though widespread use of navigation apps have rendered this knowledge somewhat obsolete, it will still make any delivery job much easier, and can come in handy if you ever find yourself lost with out access to a GPS. TL;DR at the bottom.

Have you ever wondered how addresses get their numbers? It’s not random, and most cities assign these numbers based on a logical grid system. 

Every grid has a geographical center where the numbers start at 1 and increase the farther you travel from the center. I live in Denver, Colorado so I’ll use it as an example. 

The grid center in Denver is the intersection of Broadway and Ellsworth Ave. If you look at the small numbers in the bottom right corner of the street signs they will both be “000”.  You can see an example of what numbers I’m talking about (for a different intersection) [here](https://imgur.com/a/mHZq8yu). 

Ellsworth is the dividing line between north and south, and Broadway is the dividing line between east and west. So since 12th Ave is 12 blocks north of Ellsworth it gets assigned 1200 N, and Cherokee St is 3 blocks west of Broadway so it get 300 W. These block numbers determine what the address will be on that part of the street. For example if you were looking for 1250 N Cherokee st, you would find it about halfway between 12th Ave and 13th Ave. Or if you were looking for 315 W 12th Ave it would be the first, second, or third building on 12th just west of Cherokee, depending on how many buildings are on that street. 

Furthermore 99% of the time addresses that are odd numbered will be on the north or west side of the street, depending on which way the road travels. While driving east/west, odd address will be on the north side of the street, while driving north/south they will be on the west side. Even numbered addresses will be on the south and east sides respectively. The only time this rule gets kinda wacky is if the street your on doesn’t travel in a pure cardinal direction, or curves from one direction to another. But even then you can still be certain that all the even numbers will be on one side and all the odd on the other. 

In Denver the grid extends into the outer suburbs, and I’d assume that true other places as well. All the way to the 18000 west block of Colfax blvd (Zeta st in Southeast Golden), the 33400 east block of Colfax all the way out in Watkins, as far north as Northglenn, and south into Parker. 

So as long as you know the address of your destination you should be able to find it by paying attention to the block numbers on the street signs. The letter before the number (N, S, E, W) will indicate which side of the city you’re on. Since the numbers only get bigger the further you travel from the center, if they are getting bigger as you are going along then you are traveling in the direction marked on the street sign, if they are getting smaller you’re going the opposite direction back towards the center. 

Of course it’s not 100% consistent. Downtown areas and suburban towns might have a different grid, and streets don’t always travel in a straight line or purely north/south or east/west. However knowing your grid can greatly help you get to where you’re going, with or without GPS. 

TL;DR: Address numbers are assigned according to a grid system. The further away from the center, the bigger the number. Odd numbers are usually on the north/west side of the street, evens on the south/east side."
1821,"YSK Daylight Saving Time just ended. If you hate it when it gets dark early, you don’t hate DST. You hate standard time. If we end DST, it would be dark earlier all year.",YouShouldKnow,"Why YSK: DST runs from March to November (we've extended it several times). If we end DST, it'll be dark 1hr earlier in those months. If we just change to DST permanently, then time in our timezones will be different than all the other countries we share them with."
1822,"YSK Daylight Saving Time just ended. If you hate it when it gets dark early, you don’t hate DST. You hate standard time. If we end DST, it would be dark earlier all year.",YouShouldKnow,[removed]
1823,"YSK: this is especially for the people present at the astroworld tragedy (but i think it's valid otherwise), do NOT agree to accept the refund if you plan to sue. It's mentioned in the fine print that you waive your right to file a lawsuit if you accept the refund.",YouShouldKnow,[removed]
1824,"YSK: this is especially for the people present at the astroworld tragedy (but i think it's valid otherwise), do NOT agree to accept the refund if you plan to sue. It's mentioned in the fine print that you waive your right to file a lawsuit if you accept the refund.",YouShouldKnow,[removed]
1825,"YSK that in the U.S., almost all vehicle manufacturers provide free lifetime warranties on seat belts and safety restraints.",YouShouldKnow,"Why YSK this is because not only do seat belts save lives, but in most states (if not all) it is required by law for all occupants to use them.

This is even more important if you're using child-seats. If you have a faulty seat belt, contact the closest dealership for your make of vehicle and verify your vehicle is eligible."
1826,"YSK that (at least, in America) most manufacturers of automobiles provide a free, lifetime warranty on seat belts/safety restraints.",YouShouldKnow,[removed]
1827,YSK A for-profit company will always try to minimize your salary. It is your duty to maximize it and there is no shame in it.,YouShouldKnow,"Why YSK: There is a mindset, especially with younger adults, that it is taboo to ask for more money. For example during a job interview a company will state your wage structure. Now, if you respectfully treat this as a business negotiation, there is nothing wrong with simply discussing it. Don't be rude but ask at least. You're not 'begging' and you're not 'being selfish'. You are putting a price on your time and labor. It is your right to ask if feel it is appropriate want to, it is their right to decline if they want to. Again, don't be rude about it if you're in either position."
1828,"YSK A profit-based company will always try to minimize your salary and that's not unfair. It is your duty however, to maximize it and there's no shame in asking for more.",YouShouldKnow,[removed]
1829,Ysk immigration to the United States is incredibly expensive and lengthy.,YouShouldKnow,[removed]
1830,YSK: there’s a huge difference between the words ‘payed’ and’paid,YouShouldKnow,[removed]
1831,"""ysk"" PLEASE HELP ME!!!!!!!",YouShouldKnow,[removed]
1832,"YSK 911 for emergencies is not the only ""-11"" number. There are 8 ""N11"" numbers you should know.",YouShouldKnow,"Why YSK: There are 8 numbers established by the FCC to access special services. These numbers can provide you with essential services, are easy to remember, and all (but one) are free! These numbers, known as N11 codes, are:

**211—Community services and information**

211 services provide free and confidential services that help people across North America. Questions about human trafficking, disaster assistance, food, health, housing utilities, as well as jobs and support for veterans or some of the services offered. Often 211 services are operated by the United Way of America. 
 
**311—Municipal government services**

Many cities and towns in the US have deployed 311 services in an attempt to offload non-emergency requests from citizens. Under existing networks, these calls are sent to already over-burdened 911 centers. With 311 centers, residents can inquire about anything- from trash collection, to a municipal utility bill issue, to reporting non-active crime or other non-emergencies to the city/town government. 

**411— Reserved (directory assistance)**

Historically, 411 information services were often established to provide directory assistance or local information. However, their use has declined (because everyone has the internet now). Technically, the 411 number is reserved by the FCC and do not have a formal designation. Watch out though, most phone carriers charge for this service (usually $1-2 per call). This is the only N11 number that is NOT free.

**511—Traffic information**

511 has been established for road and weather information as the transportation and traffic information telephone hotline, and is typically administered by state or region. You can call this number to get information about traffic in your immediate area. 

**611— Reserved (Phone company repair)**

This is another one of those numbers that doesn't really have a formal use any more. In some areas, 611 was used as a test code for linemen on the street or was used to report troubles to the central office from a subscriber. Many phone and cable providers still use this number as a way for customers to report problems with their service or to make inquiries.

**711—TDD and Relay for the Deaf**

Every telephone company is required to connect persons who dial 711 to a Telephone Relay Service (TRS) from a device on a working number. This rule was extended to include all VoIP telephones in July 2007 by the FCC. 


**811—Underground public utility location**

In March of 2005, the FCC established 811 as the universal number that would coordinate location services for underground public utilities. This safety measure not only helps prevents damage that interrupts telecommunications, but also the cutting of subterranean power lines, water mains and natural gas pipes. Call before you dig!

**911—Emergency services (police, fire, EMS)**

The one we all know! Single-number access for all emergency services, including police, fire and medical.

In addition to these numbers, **988** is currently in the process of being adopted as the number for the **National Suicide Prevention Hotline**. The change will fully go into effect on July 16, 2022."
1833,"YSK 911 for emergencies is not the only ""-11"" number. There are 8 ""N11"" numbers you should know.",YouShouldKnow,[removed]
1834,YSK that your friends that say they actually then stop being friends with you are just some toxic people I need help on what and how to respond to that,YouShouldKnow,[removed]
1835,"YSK the interrobang (‽) is a non-standard punctuation mark indicating a question asked in an excited manner, expressed excitement or disbelief in the form of a question, or asks a rhetorical question.",YouShouldKnow,[removed]
1836,YSK Just do whatever you want at this point,YouShouldKnow,[removed]
1837,Make your Business Meetings one of the profitable business rituals ever (ysk),YouShouldKnow,[removed]
1838,YSK that in the US the Post Office will send free shipping supplies to your door,YouShouldKnow,[removed]
1839,"YSK: In the United States, if you are forced to quit do to unreasonable work demands, you can still apply for unemployment benefits.",YouShouldKnow,"Why YSK: because, contrary to popular belief, you do not have to be fired or laid off to apply for unemployment benefits. You have to be able to prove the workload demands were unreasonable, but you are allowed to quit and receive unemployment. With droves of people quitting and employers shifting the workload to other employees without adequate compensation, this is important to know."
1840,"YSK HaveIBeenPwned is a website that can tell you if your sensitive information (email, password, address) can be found in data leaks.",YouShouldKnow,"Why YSK: Having your information being included in a data leak can be a huge security concern. If you reuse the same email / password combinations across multiple websites, a data leak from just one of those websites can jeopardize all your other accounts. You can use HaveIBeenPwned to see if your email, password, address, license plate, etc are found online due to any recent data leaks. 
I don't have any affiliation with this website. I just heard about it this year and think it's a great tool people should use."
1841,"For the record: I am not a Bible scholar, and have no formal training in any way. ysk",YouShouldKnow,[removed]
1842,YSK This genius is getting huuge research grants despite his plagiarism,YouShouldKnow,[removed]
1843,YSK You can hold artists accountable on Spotify,YouShouldKnow,[removed]
1844,"Ysk that ur mom so fat she got stuck in a well, but not the bottom of it",YouShouldKnow,[removed]
1845,"YSK That when you must bend at the back, do so equally with both your left and right sides",YouShouldKnow,"There are several methods online on how to properly bend at the back when you must. The most important thing to do is make sure to square up in front of your target and apply your back equally at the left and right sides. You should always lift with your legs. However, there are times where you must eventually apply your back.

Why YSK: If you favor one side of your back, either left or right, you will develop cramps which will lead you to back pain almost instantly. Using both sides of your back properly will ensure that you don't stress one side more than the other to prevent back pain and aches."
1846,"YSK The core issue of the Rittenhouse trial is and has always been the murder of Rosenbaum, NOT Grosskreutz",YouShouldKnow,"Why YSK: Many articles are coming out about how Grosskreutz pointed a gun at Rittenhouse before Rittenhouse shot and wounded him. But everyone already knew that from the videos taken that night.

Grosskreutz and others ran after and attacked Rittenhouse AFTER he murdered another person named Rosenbaum. The big question is “Did he kill Rosenbaum in self-defense”? We don’t have video of that first shooting.

There are two witnesses who claim that Rosenbaum attacked Rittenhouse and he had reason to fear for his life. But there are a few problems:

Rosenbaum was unarmed and didnt hurt anyone that night. One of the witnesses is a journalist for the far right publication The Daily Caller. And the other is someone who was there “patrolling” with Rittenhouse that night.

Make of that what you will."
1847,"Hotel music 2021, lounge bar music, cafe music , best lounge music for luxury hotels 2021 ysk",YouShouldKnow,[removed]
1848,YSK Never buy a house from flippers!!!,YouShouldKnow,"&amp;#x200B;

Why YSK: If you reach the phase in your life of buying a house, who were the previous owners matters a lot. Your top priority are houses that the owner lived in them. Owners usually take care of their houses, and invest a lot of money in quality repair (although there is also the risk that the person was a DIY type and the fixing was amateurish). Your intermediate priority is to buy from a house that was rented to other people. Renters don't take care of the house they live in. The age of the people who lived in the house also matters (if you can get this information), as college students will be more destructive than old people. Finally, whatever you do don't buy a house from flippers. These are people that buy rickety houses, fix them, and sell them for maximum profit. They know that the average customer is clueless in house repair, and their fixing is usually cosmetic. You'll get a house with many problems.

Bonus tip: When you go to an open house, the owners usually hire a furniture staging company. The staging is not random. Carpets might be placed to hide messed up floor boards, and furniture could be used to hide damaged walls. Look behind and underneath the furniture when evaluating a house."
1849,YSK Never buy a house from flippers,YouShouldKnow,[removed]
1850,Why YSK Gravity Water Filter,YouShouldKnow,[removed]
1851,YSK How Do Gravity-Fed Water Filters Work,YouShouldKnow,[removed]
1852,YSK how to increase your chances of survival in a crowd crush,YouShouldKnow," Why YSK: The recent tragedy at the Travis Scott music festival event isn't a one-off and you could find yourself in a similar situation.

As someone who has been in a crowd crush, I can assure you it's horrifying, and it shouldn't happen if the crowd has been organized correctly.

Even in cases when it's not lethal, serious injury occurs, and it can be traumatizing. You should know there are things you can do to protect yourself if you find yourself in a crowd crush.

* **Know the signs.** It's important that you can recognize when a crowd is progressing towards a crush. The most obvious way to recognize this is if you can't lift your hands up high enough to touch your face. This means the amount of people per square meter has gone past a safe level. Before things get dangerous, if the crowd moves slightly and you move with it against your will, it's time to begin finding a way out because if a bigger, stronger push comes, you will be taken with it. What are people around you saying? Take notice of other people's energy. Are they panicked? Are they uncomfortable? Are they saying things that echo your own anxiety around what could be a developing danger? The best time to notice these red flags is just before the show starts, because in all likelihood once it's started, those movements will be much harder to fight against, and it is going to be loud. So stay vigilant to this leading up to the start of a show.
* **Locate exits.** Once you know things are getting hairy, scan the area for your best exit options and begin moving to the closest. Is it the barrier at the front of the crowd? Or is it behind you where the crowd is less compressed? You need to have your bearings or you could find yourself moving deeper into crowd. How many rows of people are there between you and the exit? Take a mental note. Before the show starts, you need to know which direction to head in if things become dangerous.
* **Protect your chest.** The main cause of death in a crowd crush is suffocation. This is caused by surrounding bodies compressing your chest so no oxygen can flow. Get your arms up to your chest like your a boxer, and use them to keep people off you to your best ability. Maintain the guard and apply force with your arms to keep people at bay, and give yourself breathing room. Videos from Astroworld show a lot of people with their arms at their side. They likely didn't know about this strategy.
* **Keep upright/move with the crowd.** Another major cause of death in crowd crush is trampling. Staying on your feet is easier said than done, especially if there is a collapse near you. If you've ever experienced a dense crowd, you know that the waves are strong. No matter how good and sturdy your footing is, you aren't going to be able to fight against the weight. The best way to avoid falling over is to move with the flow of the crowd. The moment you feel the wave coming, allow yourself to move in its direction and focus on staying up. Continue in the direction of your best exit between waves.
* **Stay calm.** It takes a long time to get out, you need to keep a level head so you can focus on protecting your chest, staying upright, and getting to the exit. If you begin to panic, you'll also start beathing faster. In a situation where suffocation is the main cause of death, staying calm will regulate your breathing and preserve your most important resource.
* **Help others.** Finally, your own survival is obviously critical but that doesn't mean looking out for number one at all cost. In fact, the opposite is true. Working together is the best way to avoid mass death in crowd crush. Helping people (when you can) get off the ground, or making sure people don't fall will actually increase your chances of getting out faster, and if you fell you'd definitely want someone to help you.

You can read more about the physics of crowd crush, and the survival tips here: [https://theconversation.com/ten-tips-for-surviving-a-crowd-crush-112169](https://theconversation.com/ten-tips-for-surviving-a-crowd-crush-112169)"
1853,YSK how to increase your chances of survival in a crowd crush,YouShouldKnow,[removed]
1854,YSK how to increase your likelihood of survival in a crowd crush,YouShouldKnow,[removed]
1855,YSK clothes dryers can fail leaving the heating element on after a cycle ends,YouShouldKnow,[removed]
1856,YSK: There’s a shortcut to switch between Reddit light/dark mode on mobile,YouShouldKnow,[removed]
1857,YSK clothes dryers can fail leaving the heating element on after a cycle ends,YouShouldKnow,[removed]
1858,YSK that quickly comparing health insurance plan costs during open enrollment (now!) can save you thousands in health insurance costs next year [USA],YouShouldKnow,"Why YSK: Many people stick with the health insurance plan they've had for years, but annual changes in premiums and out-of-pocket costs can have big impacts on your actual and potential expenses. By using a spreadsheet to compare overall costs, you can choose the most cost-effective plan that your employer offers. Sometimes that choice even bucks conventional wisdom like ""HSAs are only for young, healthy, single people"" and ""Definitely choose the most expensive plan if you are going to have a baby."" The right choice is specific to the plans offered by your employer!

In  the US, the Open Enrollment period at the beginning of November is the only time during the year you can make changes to your health insurance  plan (barring certain life events). Many companies offer several plans  with different cost structures, and doing a thorough comparison can save  you more money than you would think. Many times, the most expensive plan is NOT the best choice, even if you know you will have a lot of  medical costs.

Here is a spreadsheet template you can save a copy of. Fill in the outlined section at the top with the various plans offered by your/your spouse's  employer: [https://docs.google.com/spreadsheets/d/18kLItQPl3DVFN4TnKJrA4ZUurWirj5IP1hooipTiY7g/edit?usp=sharing](https://docs.google.com/spreadsheets/d/18kLItQPl3DVFN4TnKJrA4ZUurWirj5IP1hooipTiY7g/edit?usp=sharing)

Look  at your company's offerings to find the monthly premium, deductible,  coinsurance, and out-of-pocket maximum. If your company offers a  High-Deductible Health Plan (HDHP) and has an HSA (health savings  account) contribution they add, include that, too.

Once you've replaced my sample numbers with your own, look at the graph to  see how much you will pay in total (premiums, deductible, total  out-of-pocket costs) to choose the right plan for you or your family.

I  often see posts on Reddit that HSA plans can be very cost-effective for young, single people who don't have many medical expenses.  Additionally, many assume that if they know they will incur large costs  (e.g. major surgery, having a baby) during the year, then they should choose the most expensive plan that covers the most. *In many cases, that is not true!*  High-deductible health plans often have such low premiums that they  come out less expensive overall than traditional ""gold/platinum"" PPO  plans, even if you incur tens of thousands of dollars in medical  expenses."
1859,"YSK: if you win that 2.6 million dollar house in Miami that’s being advertised on here, you should take the cash option unless you can afford $2166 a month in property taxes.",YouShouldKnow,[removed]
1860,YSK All mechanic shops use Alldata and you can too!,YouShouldKnow,[removed]
