,title,subreddit,selftext
0,"YSK know that there is a finite amount of money in the world and the more some have, the less others get",YouShouldKnow,"Why YSK:  We're in a period where the wealthy keep getting wealthier and the poor are getting poorer, due to inflation and the stagnate wage growth the last 20-40 years. While true, the money we use today is fiat, it's value is always in flux and more can be printed, there's still a definite amount of it out there and the more individuals and corporations hoard onto themselves, the less there is for the rest of us. This basic fact seems to have been forgotten by people over the years due to the influence of Reaganomics and conservative ideologies. 

We've glamorized billionaires as a model of success and evidence that not only does the capitalist/American dream work, but that anyone can achieve it too and have ignored the fact that they are, in fact, cheating the rest of us out of our fair share. We should be outraged by this, that's why you should know."
1,"YSK picking a proper name for children is crucial &amp; can be life-changing, don't take it lightly, don't pick stupid or ""fun"" ones",YouShouldKnow,"Why YSK? According to studies, picking names have a long-lasting effect on children's lives as they grow up. They can even affect school admissions &amp; employment.

A child's name is not a social statement or a cool experiment, it's permanent &amp; goes to become part of their core identity &amp; self-worth.

Our names can shape our psyche &amp; are reminders of how much our parents care about us. It can vastly hurt or improve life experiences.


Further reads:

https://deepenglish.com/lessons/names-affect-childrens-future/

https://www.canr.msu.edu/news/hello_my_name_is_the_importance_of_giving_your_child_a_good_name

https://www.psychologytoday.com/ca/blog/out-the-ooze/202010/why-the-choice-your-childs-name-matters-so-much"
2,"YSK: if you scratch the cornea of one eye, be prepared to be completely blind in both eyes for at least a day.",YouShouldKnow,"Why YSK? Because you will not be prepared for it when it happens. You might think ""ow, my eye hurts"" and then the next moment, you are blind. If you try to open your eyes, the pain of it will cripple you. They become so incredibly light sensitive that it will cause you to believe that you may actually be blind. But you won't be, unless it's for real bad.

Just tie a shirt around your head and lie down. You can't make it better by trying to look. Darkness is your best friend when you have a scratched cornea. The doctor couldn't help me. Rest my friends. It will pass.

It's crazy that even the slightest scratch can cause temporary blindness, so for all of you who ride motorcycles without sealed goggles, read this and take heed before you find out the hard way. 

Also, wait until you can see again and then look at your eyeball. You will actually be able to see the scratch. It's so crazy looking."
3,"YSK: if you scratch the cornea of one eye, be prepared to be completely blind in both eyes for at least a day.",YouShouldKnow,[removed]
4,YSK: There is a quick painless way to discharge static electricity,YouShouldKnow,"Why YSK: If you search for static discharge keychain on Amazon or other shopping services (I don't want to get the post removed for posting a product link or I would), you can find little keychains which are basically tiny resistors encased in plastic that you hold your finger on for a couple of seconds to discharge the static without any shock.

Some people can be sensitive to shocks, and it can be harmful to sensitive electronics. I work in computers, and it is much easier to carry one of these around as opposed to an antistatic strap. It doesn't replace an antistatic strap for working on a computer for a long time, but if I'm just replacing a memory module in a laptop or something that takes less than a minute of actually touching a PCB, it's handy."
5,YSK There is a quick painless way to discharge static electricity,YouShouldKnow,[removed]
6,"YSK: if your cat is diagnosed with FIP (Feline Infectious Peritonitis), there is an experimental CURE available.",YouShouldKnow,[removed]
7,YSK: You should know I Just moved to a new city and was robbed at gunpoint on the 1st day at a gas station. Now there’s no way to get food or gas to get to work for the next 3 days. Hopefully someone can learn from this mistake I made and avoid this in the future.,YouShouldKnow,[removed]
8,YSK: You should know I Just moved to a new city and was robbed at gunpoint on the 1st day at a gas station. Now there’s no way to get food or gas to get to work for the next 3 days. Hopefully someone can learn from this mistake I made and avoid this in the future.,YouShouldKnow,[removed]
9,YSK: You should know I Just moved to a new city and was robbed at gunpoint on the 1st day at a gas station. Now there’s no way to get food or gas to get to work for the next 3 days. Hopefully someone can learn from this mistake I made and avoid this in the future.,YouShouldKnow,[removed]
10,YSK: Yesterday I Just moved to a new city and the 1st day I get robbed at gunpoint at a gas station. Now there’s no way to get food or gas to get to work for the next 3 days. Hopefully someone can learn from this mistake I made and avoid this in the future.,YouShouldKnow,[removed]
11,"YSK: There are 80 ""High Level"" Nuclear Waste Storage Sites in the United States",YouShouldKnow,"Why YSK: In the US nuclear accounts for [20% of current energy generation](https://sgp.fas.org/crs/nuke/IF11201.pdf), with the majority of the plants situated in the eastern portion of the country.  Currently, nuclear waste from plant operations has to be stored on site because there is no means of disposal."
12,YSK: IMDB ratings are mostly submitted by younger men,YouShouldKnow,[removed]
13,ysk ab Free College Resources from Harvard/MIT students,YouShouldKnow,[removed]
14,YSK your furnace Vents should not be covered by snow as it risks carbon monoxide buildup in the home,YouShouldKnow,"Why YSK: https://www.ajperri.com/blog/clear-furnace-vents-snow-risk-carbon-monoxide-poisoning

Also, there could be a pipe coming out of both sides of your home. Make sure both are clear and double check that your carbon monoxide detectors are working"
15,YSK your furnace Vents should not be covered by snow as it risks carbon monoxide buildup in the home,YouShouldKnow,[removed]
16,YSK: The United States Chamber of Commerce is NOT a government agency. Its a lobbying group.,YouShouldKnow,[removed]
17,"YSK, instead of going to the Emergency Room, many Urgent Cares can take x-rays, cast broken bones, and stitch deep cuts. Not only can this save you lots of money, but it can also save you hours in the waiting room.",YouShouldKnow,[removed]
18,"YSK If you have student loans being serviced by Navient, you may have just gotten your student loans cancelled",YouShouldKnow,[removed]
19,"YSK: You should start adding ""reddit"" after your troubleshooting search queries",YouShouldKnow,"Why YSK: Most websites offer the same few options for how to solve your problem, only a few of which truly work. Because the majority of these websites are money-making factories, they all have the same responses. If you include ""reddit"" in your search, you'll discover that someone else had the same problem and reported it to reddit, where someone (usually) answered with a decent solution.

This applies to almost everything. You wish to locate a restaurant that has something to offer? Maybe something you can't quite name? Some strange notes left in your house? You'll most likely discover the answer in an online forum, posted fifteen years ago by an anonymous person."
20,"YSK in the US, if you owe taxes, its incredibly easy to setup a payment plan.",YouShouldKnow,"Why YSK: Some accountants, document preparers, applications, etc., might offer anyone in the US who owes money to the IRS payment or installment plans. Sometimes these plans may come with significant charges or fees.

YSK that upon learning you owe to the IRS, you can mail your tax return with a statement saying you are aware of the amount you owe, and what you can offer in installments. Up to a few weeks later you will receive an installment plan agreement from the IRS, sometimes for significantly less per month than what you had offered. Each month you would receive a statement regarding what is owed, interest, payment slip, and return envelope. You can still do this even after using tax preparation software."
21,YSK Martin Luther King Jr. Day occasions in Cincinnati,YouShouldKnow,[removed]
22,YSK: You should know that you might not have to pay for tax preparing software (for US redditors).,YouShouldKnow,"Why YSK: Tax prep software is expensive as hell. In the US, if you make under a certain amount of income ($73k), you legally are entitled to free tax prep software from major companies like Turbotax and others. You can do your state and federal taxes for free if this applies to you. More information on the IRS’s website here: https://apps.irs.gov/app/freeFile/"
23,YSK OHIP will cover chest surgery for LGBT people,YouShouldKnow,"Why YSK: Because surgery costs money and you don't have to wait to change your body!

I just wanted to share this because it is so important! I recently learned that chest binders don't work the way I thought they did, as in making your chest flat. It's flat when the binder is on but it won't make you flat overall. Anyway, I started looking into what it would take to get chest surgery to get my breasts removed. That was where I found out that in Ontario they will cover chest surgery for LGBT+ people! I'm so happy! If you live in Ontario you don't have to wait or save up a bunch of money to look the way you want to look."
24,YSK: You can get a reduced price on many online purchases by searching education pricing,YouShouldKnow,"I just bought a MacBook Air that is originally $1299 for $1169 because I searched up education prices. No verification needed.

Why YSK: because you can save money."
25,YSK: You can get a reduced price on many online purchases by searching education pricing,YouShouldKnow,[removed]
26,YSK you can get reduced pricing for a lot of things by simply searching education pricing,YouShouldKnow,[removed]
27,"YSK never to say ""I request"" in a dispute letter/email. Always say ""I respectfully demand""",YouShouldKnow,[removed]
28,YSK You CANNOT be sued for donating food in good faith wishing the US,YouShouldKnow,"Why YSK: Many people seem to give restaurants, corporations and people the pass for throwing away, (and even pouring bleach) on end of day food because their is a a conception that if donated it opens up liability. 

Not only is this act of donating food protected by state Good Samaritan laws but is also protected by the [Bill Emerson Good Samaritan Food Donation Act](https://www.law.cornell.edu/uscode/text/42/1791) 

As long as the food has been prepared,stored and shipped to your knowledge along FDA standards and/or you properly notify the person of any issues with the food you CANNOT be held liable"
29,YSK you CANNOT be sued for donating food in good faith within the US,YouShouldKnow,[removed]
30,YSK: Check the status of Amazon gift vouchers you have purchased to see if they have been used,YouShouldKnow,"Why YSK: In your order history for Amazon you can check to see if any e-gift vouchers that you have purchased for other people have been redeemed.

It will say **Sent** if it is unredeemed and say **Received** if it has been used!

It might be good to remind the original recipient that it's there, maybe it's been lost and they didn't feel right telling you.

Definitely better being spent than Amazon having extra cash just sitting there!

I personally had a few unused vouchers for other people that I was able to chase up!"
31,"YSK: Pitbulls were bred to eat babies, and shouldn’t be kept as pets.",YouShouldKnow,"Why ysk: so that your babies don’t get eaten by pitbulls.

Pit bulls, or baby eating mongrels as they’re more commonly known, were bred initially for hunting, but later included breeding to hunt and eat human babies.

The timing that the breeding switched from hunting game to hunting babies occurred in the early 1900’s in the United States, where evil dog fighters, such as Michael Vick, promoted the hunting of babies."
32,"YSK: Stray cats and other animals looking for food can get stuck in food bags, metal cans, glass jars etc. A reminder about your trash - tear bags, squash and seal metal cans, and pretty much anything an animal can get hurt from",YouShouldKnow,"I have seen videos of cats getting rescued from Doritos bags, metal cans, glass jars etc. 

Why ysk: Whether you throw your trash in the regular trash or the recycling bin, animals and specifically cats might get hurt by it while looking for food. First of all, if you can, clean with water the remaining food/liquid from your trash. 

Metal cans in particular are dangerous. Not only are they about the same size as a cats head and could get them stuck there with no air but they are also sharp at the top. So try to squash and seal your cans before you throw them. 

Would appreciate if someone chime in on what to do with glass jars. Breaking them might be dangerous too so not sure."
33,"YSK: Stray cats and other animals looking for food can get stuck in food bags, metal cans, glass jars etc. A reminder about your trash - tear bags, squash and seal metal cans, and pretty much anything an animal can get hurt from",YouShouldKnow,[removed]
34,YSK that adequate heating isn't just about comfort. Keeping your place too cold to save money on heating can cost you way more in the long run.,YouShouldKnow,"Reposted to add the why YSK header.

**NOTE:** This is mainly for first-time property owners, property managers, and landlords who are likely getting inundated with heating complaints this time of year. 

It may seem cost-effective to just put a sweater on (or to ignore your tenants until it gets warmer), but if you live in a climate with big temperature shifts, it's very likely that your property REQUIRES adequate heating as part of regular maintenance. And I don't mean by law. I mean by physics.

**Why you should know/ Why YSK:** Dwellings need to be adequately heated to promote proper moisture evaporation. If it's too cold, water just hangs out and never dries out completely which can lead to rotted out floors, rusty pipes, and mould. It can also rot out insulation, which will in turn lead to even higher heating costs since it'll take more energy to heat the same space.

For those of you like me who are renting and have no control over the heat: keep a log of the daily temperature to protect yourselves if your landlords try to blame you or charge you for repairs due to things like water damage. 

And if you have particularly shitty landlords (again like me), try to store things in dry, safe places away from walls and closet corners. That's where condensation and mould tend to build up and it can ruin your stuff pretty fast--we're talking one or two weeks of bad heating. I lost all my childhood books and stuffed animals because our landlords nickel-and-dimed our heat and told us to ""put on a sweater"" even when we showed them our sweaty, mouldy walls and I don't wish that experience on anyone else."
35,YSK: Download PDF versions of all of your better appliances and save them to an “Owner’s Manuals” folder on your computer/mobile device.,YouShouldKnow,"
I found a home for about 10 years now, and during that time, I purchased a lot of different appliances and devices. Every now and then, I have an issue with one of them, and I have to try to find the owners manual. At a certain point I realized I could just consolidate everything digidly, so I created a file folder on my computer specifically four PDF versions of owners manuals, then I went and found all the ones that I owned… lawn,owners, washer/dryers, TVs, SoundBars, etc. 

It’s save me a lot of time and energy having everything available in one place for when I need it. This tip is pretty basic, but hopefully it helps somebody.

Why YSK: it helps you stay organized, find troubleshooting resources quicker, and takes up less space… and you can’t lose them."
36,"YSK shrink-flation is just as bad as inflation, but sometimes harder to identify!",YouShouldKnow,"Why YSK: Shrink-flation occurs when manufacturers and retailers  keep prices the same but give you less product while the consumer is not necessarily aware that they are receiving less product. 

Watch out for slightly redesigned packaging for stuff you normally buy. If the package says ""new look"" or ""new packaging"", this could be a tipoff. 

For example, my family buys a particularly brand of hand soap. It cost $2.99 for a 12oz bottle for the last couple of years. Then a few weeks ago, I noticed the bottle was now 11.4oz and the price stayed the same. The ""new improved package"" was meant to hide the fact that you are receiving less product for your money!"
37,YSK that adequate heating isn't just about comfort. Keeping your place too cold to save money on heating can cost you way more in the long run.,YouShouldKnow,[removed]
38,YSK that using the brushes at the car wash is usually bad for your paint,YouShouldKnow,"Why YSK: They don’t get washed so there’s a big chance that there’s still some dirt/sand/other sharp stuff in them. They’re also not made from high-quality materials. If you want to avoid scratches while washing your car, buy a spunge.
Coming from someone who worked at a car wash for 2 years and had to handle a lot of complaints about scratches after washing."
39,YSK that using the brushes at the car wash is usually a bad idea,YouShouldKnow,[removed]
40,"YSK how to ID fake n95, kn95 or kf94 masks",YouShouldKnow,[removed]
41,YSK Whole Milk is 3% Fat.,YouShouldKnow,"There is actually not much difference between whole milk that is 3-3.5% milkfat and reduced fat which is 2%. The marketing just makes the difference seem greater by using the word ""whole"".

Why YSK: Knowing about your food is important to not be manipulated by the food industry."
42,YSK Whole Milk is 3% Fat,YouShouldKnow,[removed]
43,YSK you can maximize your donation effectiveness by checking out charities on CharityWatch or CharityIntelligence,YouShouldKnow,"Why YSK? Unfortunately, many charities are borderline criminal organizations that funnel your donations to their wealthy CEOs &amp; directors.

You want to know where your donation goes &amp; how much of it ever reaches the cause you gave to.

[CharityWatch.org](https://charitywatch.org/) &amp; [CharityIntelligence.ca](https://charityintelligence.ca/) give you the profile of most charities, their financials, compensations &amp; overall grade for donation impact."
44,YSK Winter Storm Warning gave for WV in front of Sunday snow,YouShouldKnow,[removed]
45,YSK: Nasal spray could prevent Covid infection for up to eight hours and effective against ALL variants of the virus,YouShouldKnow,[removed]
46,YSK: Disinformation Isn't New,YouShouldKnow,[removed]
47,Ysk that some restaurants don’t give employees electronic tips,YouShouldKnow,Why Ysk is because the best way for your tip to go to employees is to leave it in cash
48,Ysk That some restaurants don’t give electronic tips to employees,YouShouldKnow,[removed]
49,"YSK that there are privacy-respecting frontends to popular services such as Youtube, Twitter and Reddit",YouShouldKnow,[removed]
50,"YSK: you should turn lights off when they aren't serving a purpose. even if they are LEDs and don't cost as much to run, you still contribute to light pollution.",YouShouldKnow,[removed]
51,"YSK: Per New Law, U.S. Insurers Must Cover Eight At-Home COVID Tests Per Person Monthly",YouShouldKnow,[removed]
52,YSK doctors use to recommend women put copper coins and jewelry in their vaginal canal to help fight yeast infections,YouShouldKnow,[removed]
53,YSK doctors use to recommend women put copper coins and jewelry in their vaginal canal to help stop yeast infections.,YouShouldKnow,[removed]
54,YSK that COVID is a SMOKESCREEN; Fauci made a BIO-WEAPON; China Saves Face,YouShouldKnow,[removed]
55,"YSK: LED light bulbs use a negligible amount of electricity, so you can relax and let go of that nagging feeling that you need to turn off the lights.",YouShouldKnow,"Why YSK: Those of us who grew up with incandescent light bulbs were instilled with the habit of turning off lights when you're not using them, but change in technology brings change in economics, so now that habit is what I would call irrational and perhaps even bad.

The point isn't to promote waste, but rather, I know that people nag each other over it, and many even feel guilty when leaving the lights on. In reality, it is completely unnecessary to ever go out of your way to turn off a light. e.g. if you left the house to go to the store or on vacation but you forgot to turn off a light or two; or if you are already in bed and you forgot to turn off a downstairs light.

Some people say to me ""every bit saved counts"" or ""lights off is better for the environment."" The best way to illustrate my point is to put it into perspective with numbers.

A 7 watt bulb is equivalent to \~40w to \~60w incandescent. How much does it really cost to leave a light on constantly?

7w LED @ $0.24 per KwH (Los Angeles, high electricity cost)

|24 hours|30 days|365 days|
|:-|:-|:-|
|$0.04|$1.21|$14.72|

&amp;#x200B;

7w LED @ $0.10 per KwH (US average)

|24 hours|30 days|365 days|
|:-|:-|:-|
|$0.02|$0.72|$6.13|

&amp;#x200B;

How many 7w lightbulbs equivalent are your typical home appliances?

&amp;#x200B;

|Appliance = 7w LEDs|Fridge 180w = 25.7 lights|Washer 500w = 71.4 lights|
|:-|:-|:-|
|50"" TV 70w = 10 lights|Mid Gaming PC + peripherals while gaming 600w = 85.7 lights|Dryer 800w = 114.3 lights|
|Vacuum 1400w = 200 lights|Microwave 1200w = 171 lights|Dishwasher 2200w = 314.3 lights|
|Clothes Iron 3000w = 418.6 lights|Hairdryer 1800w = 257 lights||

*In other words, if you play a game on your PC for 1 hour, that is enough electricity to power a light bulb for 3.6 days.*

Note: If you are heating your house with a thermostat and electric heating, then the electricity you use in devices is practically free, since they substitute the electricity use of your heater as they warm your house. Energy used = heat.

Besides removing any time or inconvenience spent on going back to turn off a light, there are other benefits to leaving some lights on at night. For example: a lit house may be a deterrent for burglars, and can prevent you from tripping or stepping on objects if you wake up and walk around. My house is dimly lit at night with various 0.5w to 3w lights. I will pay less than $10 over a year for that.

Some people may not find this info useful, but I know for a fact a lot of people are still anal about turning lights off. If you want to conserve electricity, you should skip the lights and find another home appliance to curb your usage of."
56,YSK that most of your stale crackers and chips can be fresh as new again,YouShouldKnow,[removed]
57,"YSK: Using your camera/phone's flash can improve your photos, even ones taken outside in the daylight",YouShouldKnow,"Why YSK: many people take outdoor photos in the shade, or with the subject's back toward the sun. This can result in dark photos which lack detail. Using your flash in these situations - known as fill flash - can improve your photos by providing light to things which are in shadow. It's also a good idea to look at your background to make sure you don't have a bright source of light behind your subject - even reflected light, as this can cause a shorter exposure which loses detail, or it can cause undesirable glare on your subject."
58,"YSK! The Uyghur Genocide! Over 1.8 million in concentration camps and thousands dead! Allegations include systematic gang rape, organ harvesting, emancipation, sterilization, and torture.",YouShouldKnow,[removed]
59,YSK There is no need for you to warm up your car longer than 30 seconds before driving it.,YouShouldKnow,[removed]
60,YSK There is no need for you to warm up your car any longer than 30 seconds before driving it.,YouShouldKnow,[removed]
61,YSK that paywalled science articles are available to you for free through Sci Hub,YouShouldKnow,[removed]
62,YSK That telling your guests to bring nothing just makes things harder on the guest.,YouShouldKnow,[removed]
63,"YSK the whole “don’t round up at registers to donate to charities, it’s just a tax write off for the business” is just viral false misinformation",YouShouldKnow,[removed]
64,"YSK that when the weather is bad out, you shouldn’t feel bad about making the driver deliver to you.",YouShouldKnow,[removed]
65,Ysk: Jews are targeted the most for hate crimes in the US (and it feels like no one acknowledges it),YouShouldKnow,[removed]
66,YSK healthcare workers will dig through your stuff to find out who you are.,YouShouldKnow,[removed]
