,title,subreddit,selftext
579,"YSK: A wood fire in the fireplace is extremely toxic for indoor air quality, and studies show just how much havoc they wreak on our health, especially for women and children.",YouShouldKnow,"The idea of huddling around a lovely warm fire with loved ones is so deeply and culturally ingrained that it can be very difficult to accept just how terrible it is for health. But the health risks are clear, and smoke from a wood fire damages your respiratory system and heart in a similar fashion to cigarette smoking. Light fires frequently enough and it can become much worse.

The [Wikipedia](https://en.wikipedia.org/wiki/Fireplace#Health_effects) summary perfectly describes how bad it is:

&gt;With regard to adults, studies show that prolonged inhalation of [wood smoke](https://en.wikipedia.org/wiki/Wood_smoke) contributed to [chronic bronchitis](https://en.wikipedia.org/wiki/Bronchitis#Chronic_bronchitis), chronic interstitial [lung disease](https://en.wikipedia.org/wiki/Lung_disease), [pulmonary arterial hypertension](https://en.wikipedia.org/wiki/Pulmonary_arterial_hypertension) and [corpulmonale](https://en.wikipedia.org/w/index.php?title=Corpulmonale&amp;action=edit&amp;redlink=1) (Pulmonary heart disease), and altered pulmonary immune defense mechanisms. While adverse effects on adults are notable, children appear to be at greatest risk. Many studies that focused specifically on RWC \[Residential Wood Combustion\] have concluded that young children living in homes heated by a wood-burning stove had a greater occurrence of moderate and severe chronic respiratory symptoms than children of the same age and sex who did not live in homes heated with a wood burning stove. Exposure of preschool children living in homes heated with wood burning stoves or in houses with open fireplaces yielded these effects: decreased pulmonary [lung](https://en.wikipedia.org/wiki/Lung) function in young [asthmatics](https://en.wikipedia.org/wiki/Asthmatics); increased incidence of acute [bronchitis](https://en.wikipedia.org/wiki/Bronchitis) and severity/frequency of [wheezing](https://en.wikipedia.org/wiki/Wheezing) and [coughing](https://en.wikipedia.org/wiki/Coughing); and increased incidence, duration, and possibly severity of acute [respiratory infections](https://en.wikipedia.org/wiki/Respiratory_infections). Residential wood combustion [emissions](https://en.wikipedia.org/wiki/Exhaust_gas) also contain [sulfur oxides](https://en.wikipedia.org/wiki/Lower_sulfur_oxides), [nitrogen oxides](https://en.wikipedia.org/wiki/Nitrogen_oxides), [carbon monoxide](https://en.wikipedia.org/wiki/Carbon_monoxide) and potentially [carcinogenic](https://en.wikipedia.org/wiki/Carcinogenic) compounds including [polycyclic aromatic hydrocarbons](https://en.wikipedia.org/wiki/Polycyclic_aromatic_hydrocarbons), [benzene](https://en.wikipedia.org/wiki/Benzene), [formaldehyde](https://en.wikipedia.org/wiki/Formaldehyde) and [dioxins](https://en.wikipedia.org/wiki/Dioxins_and_dioxin-like_compounds). Some of these pollutants are known to cause cancer but their effects on human health via exposure to wood smoke have not been extensively studied.[\[9\]](https://en.wikipedia.org/wiki/Fireplace#cite_note-9)The Washington State Department of Ecology also published a booklet explaining why wood smoke can be dangerous. It explains that human lung and [respiratory systems](https://en.wikipedia.org/wiki/Respiratory_system) are unable to filter [particulates](https://en.wikipedia.org/wiki/Particulates) emitted by wood combustion, which penetrate deeply into the lungs. For months, [carcinogens](https://en.wikipedia.org/wiki/Carcinogen) can continue to cause changes and structural damage within the respiratory system. Young children, seniors, pregnant women, smokers and individuals with [respiratory diseases](https://en.wikipedia.org/wiki/Respiratory_disease) are most vulnerable. Wood smoke can cause disease and even death in children, because it is associated with [lower respiratory tract infections](https://en.wikipedia.org/wiki/Lower_respiratory_tract_infection).[\[3\]](https://en.wikipedia.org/wiki/Fireplace#cite_note-Ecology-3) Home fireplaces have caused fatal [carbon monoxide poisoning](https://en.wikipedia.org/wiki/Carbon_monoxide_poisoning).[\[10\]](https://en.wikipedia.org/wiki/Fireplace#cite_note-10)

[EPA](https://www.epa.gov/burnwise/wood-smoke-and-your-health)

&gt;The smoke from wood burning is made up of a complex mixture of gases and fine particles (also called particle pollution, particulate matter, or PM). In addition to particle pollution, wood smoke contains several toxic air pollutants including: benzene, formaldehyde, acrolein, polycyclic aromatic hydrocarbons (PAHs)

[Heart.org](https://heart.org/)

&gt;A [2013 study](https://www.ncbi.nlm.nih.gov/pmc/articles/PMC3685524/) in the journal *Particle and Fibre Toxicology* found exposure to wood smoke causes the arteries to become stiffer, which raises the risk of dangerous cardiac events. For pregnant women, a [2019 study](https://www.ncbi.nlm.nih.gov/pubmed/30253313) in *Environmental Research* connected wood smoke exposure to a higher risk of hypertensive disorders of pregnancy, which include preeclampsia and gestational high blood pressure.

Why YSK: I thought that this would be a good YSK since it is the winter holidays, and a wood fire is anchored in our mind as a part of a picture-perfect holiday evening. But the truth is that they are completely awful, and many of us in modern society are still completely naïve to this fact. Just like led-based paint, asbestos, and smoking around children, it needs to be on its way out. Some states are already offering tax incentives to replace old fireplaces. Please just use an alternative method of heating if you have it."
580,"YSK: A wood fire in the fireplace is extremely toxic for indoor air quality, and studies show just how much havoc they wreak on our health, especially for women and children.",YouShouldKnow,[removed]
581,YSK that it’s okay if you aren’t completely enamored with your child as soon as they are born,YouShouldKnow,
582,YSK that it’s okay if it isn’t “love at first sight” when your child is born,YouShouldKnow,[removed]
583,"YSK: Reddit has been adjusting some subreddits so the six-month archive limit no longer applies. This includes /r/StarWarsBattlefront, so the ""pride and accomplishment"" comment is now eligible for further downvotes.",YouShouldKnow,[removed]
584,YSK: How to save cash to get out of a relationship with someone who is financially controlling you.,YouShouldKnow,"Why YSK: with someone who is controlling your finances leaving may seem impossible- this advice could help you save funds to help with leaving. 

If you need to save cash to get away from an abusive partner who has financial control- use grocery trips to put away money a little at a time. 

If your partner will not see/check the itemized receipt, just get cash back when checking out and save that cash somewhere safe. Bank statements will show the total grocery store bill without showing any cash was withdrawn. 

If your partner does check the itemized receipt, many stores now have free apps to clip digital coupons- my local store (giant) will give cash back for any digital coupons that did not properly come off during check out. Any coupons not “clipped” at least 30 minutes before a check out have to be manually paid out. 

I got $15 cash back from customer service today that will not show up on any receipt or bank statement. Thankfully this is not something I need to worry about , but I thought it may help someone in a difficult situation."
585,"YSK that Time's Person Of The Year is NOT an award or praise. It is simply the person who had the biggest impact on the year's news, good or bad.",YouShouldKnow,[removed]
586,YSK cucumbers aren’t the only delicious thing that is pickled.,YouShouldKnow,"Why YSK: other good for yous like mushrooms, onions, carrots, asparagus and even cauliflower taste amazing when pickled. 

An oft forgotten yet delicious way to get fiber and nutrients."
587,YSK: Cucumbers aren’t the only delicious pickled vegetables,YouShouldKnow,[removed]
588,I will do youtube SEO to increase views and subscribers YSK,YouShouldKnow,[removed]
589,YSK your dishwasher has a filter and we all know you've never cleaned it.,YouShouldKnow,[removed]
590,YSK: Be nice to people,YouShouldKnow,Why YSK: Why be mean when can be nice? Bet you never thought about it that way. Share your stories.
591,"YSK: When making a sex tape , play Disney music in the background",YouShouldKnow,"Why YSK: That way, if it get's leaked online, Disney lawyers will have them all taken down. 

Your welcome"
592,YSK that gifting someone hairwash and bodywash for Christmas is not okay (unless they requested it),YouShouldKnow,"Why YSK: gifting someone hair and bodywash is like telling them: ""Hey I can smell your odor from here and I think this will be useful for you."" It's not a decent gift to give to anyone, even as a joke. Not to mention they could be allergic to the products you bought too. You could buy them a gift card to the store you bought these products and it would be a better option."
593,YSK that gifting someone bodywash or hairwash for Christmas is not okay (unless they requested it),YouShouldKnow,[removed]
594,YSK - Should You Lower Tire Pressure When Off-Roading?,YouShouldKnow,[removed]
595,YSK: How to save money to leave a financially controlling/abusive partner.,YouShouldKnow,[removed]
596,"YSK: An article/news item with information like 'X % of people do/believe Y' may not be really useful, accurate or relevant.",YouShouldKnow,"Why YSK:Frequently editors or even newspapers may unintentionally or intentionally interview or perform the survey in a area which is *not representative* of the *total population*. This is to influence the audience in a particular way 

Without using complex statistics jargon, here goes.

Example (not real data):
You live in Houston state in USA and see a interview that 80% of Americans surveyed believe a increase in the price of burgers (anything else) is expected in the next 12 months.

For the survey to have any value, all states, and all areas within the state's having diverse people should be represented equally in the survey to make it representative of America.

A simple act of conducting survey or interviewing people in an American city where the price of burgers has been steadily increasing in the recent past will give the survey a majority *positive* response. And vice-versa.

This response is not really representative of America."
597,YSK : A statistic like '95 % of people surveyed in X believe/do [some action / belief] Y' in a newspaper or non scientific article is meaningless.,YouShouldKnow,[removed]
598,"YSK: 99% of women who wear ankle bracelets are just wearing jewelry, not signaling that they are in an open relationship.",YouShouldKnow,"Why YSK: 

It's  misguided to assume that a woman who is wearing an anklet is  advertising anything beyond the fact that she enjoys wearing the jewelry  as an accessory.

Apparently,  there is a fringe group of dodgy folk who believe that anytime they see a  woman wearing an anklet, she is signaling that she is in an open  relationship (aka, a ""hotwife""). This is a poor assumption, and  demeaning to any woman who is a target of this kind of warped  perception. She doesn't deserve the off base thoughts about her, the  unwanted looks, and certainly not having some oaf make overtures toward  her, simply because she is wearing a piece of jewelry.

Women  don't need to send secret messages through their jewelry to signal that  they are looking for sex. Even if there is a small percentage of women  who do intentionally wear anklets to signal something, most women do not  do this. Those who do, will probably be sending out all kinds of ***other***  signals to show a man that they are sexually interested in him; they  won't simply be wearing an anklet and going about their business."
599,"YSK that 99% of women who wear ankle bracelets are just wearing jewelry, not signaling that they are in an open relationship.",YouShouldKnow,[removed]
600,YSK: Clean your toilet after a cleaning,YouShouldKnow,Why YSK: Many people (Including cleaners) don't think to wipe toilet seats down with a rag and water after using cleaning solution or cleaning wipes (like lysol wipes). The remaining cleaner residue will burn your bottom prompting you to have an itchy bottom.
601,YSK: Clean your toilet after a cleaning,YouShouldKnow,[removed]
602,YSK: Clean your toilet after a cleaning,YouShouldKnow,[removed]
603,YSK: rubbing your hands with cooking oil before washing with soap can effectively remove grease or plant based resins,YouShouldKnow,[removed]
604,"ysk Pluto is about only 2,300 km in diameter",YouShouldKnow,[removed]
605,"YSK That anger, irritability and frustration are symptoms of anxiety and/or depression.",YouShouldKnow,[removed]
606,Ysk/pls watch my new video,YouShouldKnow,[removed]
607,Pls watch my new video ysk,YouShouldKnow,[removed]
608,"YSK: if you are over-taxed as a caregiver to a family member in a private home, you can get in-home help, probably at no cost to you.",YouShouldKnow,[removed]
609,YSK: How to get Academic papers for free.,YouShouldKnow,[removed]
610,YSK that videogame CDs for playstation and Xbox can hold up to 50gb of data,YouShouldKnow,"Why YSK? Because if your getting a game next year for your kid or friend for Christmas or a birthday you can buy the disc and the install time will be shorter.also, will provide trade value for the future. Win win"
611,"YSK: The popular Bluetooth tracker company Tile was recently bought out by Life360, a company whose business model was primarily rooted in selling the location data of its 31 million customers including children",YouShouldKnow,"[Source](https://www.theverge.com/2021/12/9/22820381/tile-life360-location-tracking-data-privacy)

**Why YSK**: Many people bought Tiles over the years because they wanted a good quality convenient bluetooth tracking device for their keys or valuables. With the introduction of Apple's Airtags and Galaxy SmartTags, Tile has been under a lot of pressure with their extremely limited network. Now that their parent company has switched to one whose philosophy is radically different, those who bought Tiles in the past should reconsider if they want to continue using those products and lose out on a large part of their privacy.

Also something Tile customers may want to know is that Mark Zuckerberg's sister sits on Life360's [board of directors](https://investors.life360.com/investor-relations/?page=board-of-directors).

It is worth noting that when asked about the parent company change, a Tile representative stated, ""Tile does not sell/monetize personal data and we have Life360’s full support and commitment to continue that,"" but that remains to be seen."
612,YSK: The morning after/plan b pill looses effectiveness if you weigh too much.,YouShouldKnow,"Why YSK: The morning after/plan b pill, is the most effective if you weigh ON AVERAGE less than 170lbs. The weight limit does very by brand so always ask the pharmacist about the weight limit when you buy. This doesn't mean it WON'T work. It may work anyway and it won't hurt you to take it.  Just don't rely on it as a sure thing.

https://www.plannedparenthood.org/learn/teens/ask-experts/whats-the-weight-limit-for-plan-b"
613,YSK the morning after/plan b pill looses effectiveness if you weigh too much.,YouShouldKnow,[removed]
614,YSK. The morning after/plan b pill has a weight limit to its effectiveness.,YouShouldKnow,[removed]
615,"YSK about the Fundamental Attribution Error, a key concept in psychology where we judge others based on their actions but ourselves based on our intent.",YouShouldKnow,"Why YSK: if someone is annoying you or does something that you disagree with, remember that you can’t see inside their thoughts.   

When you cut someone off in traffic, it’s because you were being absentminded or because you’re late to sing lullabies to your newborn, right? But when someone cuts YOU off, it’s because they’re a jerk. You don’t know their inner thoughts, just the result in produces in the world.   

So: take it easy on your fellow people this holiday season, and remember the fundamental attribution error. You’ll be less stressed, less annoyed, and maybe even happier!"
616,"YSK about the Fundamental Attribution Error, a key concept in psychology where we judge others based on their actions but ourselves based on our intent.",YouShouldKnow,[removed]
617,YSK that most firefighters struggle with their weight/health.,YouShouldKnow,"Year round, but especially during the holidays, the public accosts their nearby fire station with food. More often than not it is sweets and candy. Many firefighters are obese due to poor diet and lifestyle choices, their job doesn’t make it very easy either. And with obesity, increased tobacco use (again, personal choice), sleep deprivation, and the volatile chemicals they’re exposed to throughout their careers, many firefighters aren’t in perfect health. 

Why YSK this is because many firefighters are struggling with sleep apnea, poor heart health, and obesity. Also, many firefighters are uncomfortable with the gratitude. They certainly appreciate the public support but many view themselves as regular people and regular would and do do the things they do. Paying your taxes which pay us and buy us equipment is the greatest thing you can do for them. 

YSK that many firefighters often meal prep and/or cook family style dinners at the station. Any and all sweets and baked goods you bring will end up in a pile and either get thrown away or eaten. This causes a lot of fights at the station. They really don’t need or want anything from the public and the gesture is largely forgotten almost as soon as you leave the property because you are not the only person who had that idea. 

YSK that if you absolutely must bring something to the local fire station, it doesn’t have to be grilled seared chicken breast with asparagus cooked in avocado oil. Just let it be substantial and not junk food. It’s hard enough living a healthy lifestyle without the public pressuring you to eat their cookies and muffins, they don’t need the extra temptation. 

Thanks for listening to my PSA."
618,YSK: You can humble your kids by not getting them anything for Christmas one year.,YouShouldKnow,[removed]
619,YSK Most firefighters struggle with their weight.,YouShouldKnow,[removed]
620,YSK Haunted places that will amaze you,YouShouldKnow,[removed]
621,[ysk] Haunted places that will amaze you,YouShouldKnow,[removed]
622,"YSK I've worked in the sexual assault prevention space. Statistically, it's much safer to walk at night alone as a woman than a man in America. Women are far more likely to face danger from someone they know (usually an intimate partner). Misconceptions make it harder to fight actual sexual assault.",YouShouldKnow,[removed]
623,YSK that it’s important to run cold water when using a garbage disposal.,YouShouldKnow,[removed]
624,"YSK: Subscribe to ""difficult to cancel"" services like the New York Times through the Google Play/Apple App stores whenever possible to be able to easily cancel later without speaking to a live agent.",YouShouldKnow,"Why YSK: Services such the NY Times are notorious for making you speak to a live agent and go though an arduous process to cancel the service you easily signed up for online.

Services like this are not rare and growing day by day, however many allow you to sign up through the Google Play/ Apple App Store if you do so via their mobile apps instead of the websites.

If you do this, you can easily cancel these subscriptions on your phone in just a few clicks without having to bother with each service's customer care."
625,"YSK: the ""Immaculate Conception"" refers to the birth of Mary, not Jesus.",YouShouldKnow,"Why YSK: this just seems like a super common misconception. 

The idea is that Mary was born free from sin. 

Given the time of year I thought it might be helpful to clarify."
626,"YSK about the Fundamental Attribution Error, a key concept in psychology where we judge others based on their actions but ourselves based on our intent.",YouShouldKnow,[removed]
627,What Should You Do After Computer Science? ysk,YouShouldKnow,[removed]
628,"YSK: the ""Immaculate Conception"" refers to the birth of Mary, not Jesus.",YouShouldKnow,[removed]
629,"YSK that the ""Immaculate Conception"" refers to the birth of Mary, not Jesus. The idea is that she was free from sin at her birth.",YouShouldKnow,[removed]
630,YSK Life is like a box of chocolates....but try finding one🎁,YouShouldKnow,[removed]
631,"YSK: The Police is NOT your friend, even if you called them on a robbery, murder or whatever. They'll question you and try to find chinks under your armor. You're guilty to them until they prove you're innocent. DO NOT trust them. DO NOT talk more than you need to.",YouShouldKnow,"Why YSK:

The Police is NOT your friend, even if you called them on a robbery, murder or whatever. They'll question you and try to find chinks under your armor. You're guilty to them until they prove you're innocent. DO NOT trust them. DO NOT talk more than you need to.

The way police works is they come across strong, bold and in control. They try to throw you off your center so you lose your cool and give in. They go on attack mode, things like ""I'm smelling marijuana"" or ""your activity here is suspicious."" You can go on attack mode and say ""you're being suspicious here too. I feel like I'm being profile based on my race"" or you can cooperate, yet still know what's going on. 

In any case, they're not there for you! They're not your friend no matter how trustworthy or friendly they are. Even if you call them on someone else, they'll see if you have anything wrong with you. They'll question you like suspect.

Best thing to do is know your rights, keep it short and let them go. Think of them as hungry lions or savages there to bite you until they find a weakness. This state of mind puts things in perspective."
632,"YSK: The Police is NOT your friend, even if you called them on a robbery, murder or whatever. They'll question you and try to find chinks under your armor. You're guilty to them until they prove you're innocent. DO NOT trust them. DO NOT talk more than you need to.",YouShouldKnow,[removed]
633,YSK - Who Makes Tracker ATV?,YouShouldKnow,[removed]
634,YSK: The 3G spectrum phase-out in 2022 will affect certain devices,YouShouldKnow,"Why YSK: Certain medical devices, tablets, smart watches, vehicle SOS services, home security systems, and other connected products may be using 3G network services. Don't forget about devices that use cellular connectivity as a back-up when a wired internet connection goes down. If the device is not labeled, contact the monitoring company or other service provider to confirm how the device connects and whether your device may be impacted."
635,YSK You can buy wholesale blankets to donate to your local homeless/animal shelter,YouShouldKnow,"Go to a hospital blanket wholesale website (I’ve used [www.bidssupply.com](www.bidssupply.com)!) and buy blankets in bulk. They come in bundles of 40 and you must make a minimum purchase of 5 bundles (at least on bidssupply). The one’s I’ve looked at cost $7.49 per bundle and (with 5 bundles) $22 shipping. So, for around $60, you could donate 200 blankets to your local homeless shelter or even the local animal shelter!

Why YSK: It’s getting cold outside and homeless people often can’t afford blankets. I’ve had some turn down blankets I’ve tried to give them because they’re worried about them being stolen. If the shelter has enough, that wouldn’t be nearly as much of a problem in the community!"
636,YSK can buy blankets in bulk for super cheap to donate to your local homeless shelter,YouShouldKnow,[removed]
637,"YSK VHS video cassettes degrade over time. Under average conditions, the tapes have a life expectancy of about 30 years. Those tapes laying around from the 90's with precious family memories are already significantly degraded. You should look to digitize all of your families VHS tapes now.",YouShouldKnow,"Why YSK: Many people have old VHS tapes laying around, not realizing that they will soon be degraded  beyond usefulness.  These could be the only video of loved ones, etc.  If you want to keep these memories, you must convert these to digital ASAP."
638,"YSK: Most new games consoles/games have many updates before you can use them online. If you're gifting someone a new piece of tech, make sure all the updates are done already as it can take a long time! :)",YouShouldKnow,[removed]
639,"YSK: The holiday season can be difficult for people dealing with anxiety, depression, trauma, or loss.",YouShouldKnow,[removed]
640,YSK: Money-Mart instantly Phishes you if you apply for a loan online.,YouShouldKnow,[removed]
641,"YSK that Pfizer holds the record for the largest criminal fine for an ANY organization in history, paying out billions for misleading consumers only a decade ago.",YouShouldKnow,[removed]
