,title,subreddit,selftext
1179,YSK: teach children how to be around dogs safely and appropriately. Dog bite injuries are some of the most preventable injuries in childhood.,YouShouldKnow,"Why YSK: as a caregiver it is incredibly important to keep children safe. Dogs are a huge part of many cultures and societies and teaching children the appropriate way to interact with dogs will help them avoid having a bad experience with dogs.

One thing I routinely see as a dog trainer is how many dogs are absolutely terrified of children. It’s not necessarily due to bad experience. Rather, kids move sporadically and unpredictably; they vocalize in unusual patterns. Dogs are used to human movement but children do not move in ways dogs can easily read. Many dogs will not chase an adult out for a run but will chase a child that is running around. This is partially due to the unpredictable nature of the way they move that can activate instincts to herd/chase when they see those kinds of movement patterns. To keep children in your care safe around dogs here are a few simple rules I used to explain to children I worked with:
1) If you see a dog, stop running. Try not to run or skip around dogs. A lot of dogs have herding and chasing instincts, and they may see these sudden movements an invitation to run towards you. They do not want to hurt you but they may also not want to play with you. It is safest for you to never run around when you see a dog. 
2) If a dog is scared of you, it does not mean you have done something wrong. Lots of dogs have had different experiences and do not know whether strangers will be nice to them. 
3) Do not scream or shout near or at dogs, try to lower your voice if you are playing with a dog. Screaming may scare them and many dogs will act defensively when scared. They do not want to hurt you but they may be concerned that you may hurt them.
4) If you want to say hi to a dog and the owner says it is okay, make sure the dog can see your hand. Instead of reaching for the top of their head see if they will let you pet them under the chin. Instead of approaching them from the front, you can try approaching the dog from the side with your hand extended. Dogs will approach each other from the side to indicate non threatening and friendly behavior."
1180,YSK: teach children how to be around dogs safely and appropriately. Dog bite injuries are some of the most preventable injuries in childhood.,YouShouldKnow,[removed]
1181,YSK that processed foods are just as cancerous as cigarettes.,YouShouldKnow,[removed]
1182,"YSK: Most corporations and ISPs track you through DNS and by using open source servers like Adguard DNS, you can block ads/trackers/malware on entire devices",YouShouldKnow,Why YSK: Corporations and ISPs like to track you as much as humanly possible within the law. They do this mostly through the DNS servers they automatically configure your devices to use. By blocking these tracking/ad domains you won't see any more on your entire device. DNS is being used for tracking/ads more than any time previously in the last twenty years.
1183,"YSK: ""vittles"" is actually spelled ""victuals"" (but pronounced ""vittles"")",YouShouldKnow,Why YSK:  because nearly everyone spells this word incorrectly.
1184,YSK to put only one space after a period.,YouShouldKnow,[removed]
1185,"YSK Airbnb and Ryanair don't want to refund us, but it's lockdown in Vienna. How can we get our money back?",YouShouldKnow,[removed]
1186,"(ysk) Airbnb and Ryanair don't want to refund us, but it's lockdown in Vienna. How can we get our money back?",YouShouldKnow,[removed]
1187,YSK: Walmart will pay all costs for select online degree programs while employed there.,YouShouldKnow,"Why YSK: It doesn’t seem to get talked about much for some reason, but if you live in the U.S. and want to earn a bachelor’s, associate’s, or certificate in a field like supply chain, business, or cybersecurity, this is a good option to avoid debt while making (albeit not a ton of) money.

I see a lot of talk about people struggling with education debt on Reddit, and I can’t help but think that if more people knew about this before taking on massive debt, it could really improve their lives.

If you need your GED, they’ll also sponsor that too."
1188,YSK: Odysee is a decentralized alternative to YouTube.,YouShouldKnow,[removed]
1189,"YSK FAE! No, not mythical little creatures in the forest. Fundamental attribution error.",YouShouldKnow,[removed]
1190,YSK: Some hospitals in the USA will offer significant discounts if you can prove your income is low.,YouShouldKnow,"Why YSK: Healthcare in the USA can be very unaffordable and has the potential to financially ruin people. Not many people are aware that *some* hospitals will offer discounts to your bill. You MUST ASK for these discounts, they aren't handed out like candy. Some discounts may be applied simply because you asked and were polite in doing so. Other potentially larger discounts may be applied if you can prove your income is relatively low and you are unable to pay in a timely fashion. Generally speaking, some hospitals will prefer to lower your bill and get you to pay that amount rather than send the full bill to collections. You might want to seek out hospitals that offer these discounts as opposed to ones that do not. 

As an anecdote, I had low wages and a hospital bill a number of years ago. I asked for a discount and got 45% off the bill, as well as 35% off any future bills for a whole year. I did have sign a document attesting to my wages. I had insurance at the time but the bill was slightly less than my deductible."
1191,"""YSK"" GHISLAINE MAXWELLS TRIAL IS Currently ONGOING",YouShouldKnow,[removed]
1192,Ysk : r/place is back on Twitch !!,YouShouldKnow,[removed]
1193,Ysk : r/place back on Twitch !,YouShouldKnow,[removed]
1194,Ysk: r/place is back on Twitch !,YouShouldKnow,[removed]
1195,ysk : I get emotional very fast ? How to be emotionally strong?,YouShouldKnow,[removed]
1196,YSK you are not using your dishwasher the way you are supposed to,YouShouldKnow,"[First and foremost, this video explains this better than me](https://youtu.be/_rBO8neWw04)

&amp;#x200B;

your dishwasher is not designed to use those detergent packs. It needs a little bit of detergent before it actually starts it's wash cycle, and it can't get that with only those packs. Some dish washers have a little prewash ""cup"" for detergent powder, but if it doesn't you can always just sprinkle a little bit of detergent powder on the door. Most dishwashers have a pre wash cycle where the manufacturers expected the user to add a bit of detergent. Doing this will change your dishwashing game FOREVER. I started doing this a while ago, and I rarely have a dish come out of the washer dirty. Even on the top rack.

&amp;#x200B;

TL;DR ditch the pods switch to powder. It's cheaper, and does a WAY better job.

Why YSK: because everyone wants clean dishes"
1197,"If building a spreadsheet to analyse data that will have various line counts of data, ysk to put the totals and other results at the top of the sheet",YouShouldKnow,[removed]
1198,YSK: dogs don't smile. They may look like they are but they don't display emotions like us.,YouShouldKnow,[removed]
1199,YSK: “Take a peek” is the correct spelling of the commonly used phrase.,YouShouldKnow,"**Why YSK:** When writing the phrase ‘take a peek,’ people often mistakenly use the word ‘peak’ instead of ‘peek.’ [It’s easy to understand why](https://www.grammarly.com/blog/take-a-sneak-peek-at-the-correct-ways-to-spell-and-use-these-words/) this happens, because the spelling of ‘peak’ is similar to ‘sneak,’ but ‘peek’ is the correct word to use."
1200,"YSK: Most dish soaps (like Dawn) are designed to be used in a filled sink, not directly on the sponge.",YouShouldKnow,"Why YSK: Some soap companies are changing their formula because so many people wash dishes now one by one, by putting dish soap on the sponge and then scrubbing with running water, rather than filling the sink. If you don’t have a 2 part sink, it makes it harder to wash by hand (maybe consider using a tub), but if you do have 2 sides, fill one side w water and soap, soak dishes, scrub them while submerged, and then rinse them in the other side of the sink. It not only saves on both water and soap, but will get your dishes cleaner."
1201,YSK: Do not put dielectric grease (or bulb grease) on the metal surfaces of a plug. This is the wrong way to use it and could start a fire.,YouShouldKnow,"Why YSK: Dielectric grease is an insulator, meaning it does not allow electric current to flow through it. If you apply it to the metal surfaces in a plug, you are making it more difficult for the current to flow through that connection.

The grease has many applications and benefits, but probably the most common use that people are familiar with is for vehicle headlights. You know, that little packet of white grease they upsell you at the counter when you buy new headlight bulbs.

The way you are supposed to use it is apply it around the mating surfaces of the plug, not on the metal contact surfaces. This is meant to keep water from getting inside the connector. Think of it like using caulk to seal an opening.

If you apply it to the metal surfaces, you are increasing resistance which can cause the plug to heat up. Even if you have done this in the past and haven't had any issues, please don't keep doing it because all it takes is that one time where it doesn't wipe enough off and it can cause the plug to melt, or, wort case scenario, start a fire.

I've replaced more headlight plugs than I can count because people unknowingly filled the socket with dielectric grease."
1202,YSK: Do not put dielectric grease (or bulb grease) on the metal surfaces of a plug. This is the wrong way to use it and could start a fire.,YouShouldKnow,[removed]
1203,"YSK: Dating files using YYYYMMDD format will keep them in chronological order, leading to better file management",YouShouldKnow,"Why YSK: This is especially useful when you need to save multiple versions of a file over time and can quickly reference the date from the file name instead of “date modified” or “date created”. For example, if I save a file today, I would name it “Example Text 20211203”. If I needed to save a new version in the same day, it would be “Example Text 20211203v2”.

Putting the date at the end instead of the front allows your files to be sorted alphabetically&gt;chronologically. Putting the date at the front will sort your files chronologically&gt;alphabetically."
1204,"YSK: Most dish soaps (like Dawn) are designed to be used in a filled sink, not directly on the sponge.",YouShouldKnow,[removed]
1205,"YSK: the artificial sweetener Xylitol, found in many common household items/food like toothpaste and even peanut butter, is extremely toxic to dogs. If your dog ingests even a small amount, they can die.",YouShouldKnow,"Why YSK: with the obesity epidemic and Keto craze happening in the US, Xylitol use has been on the rise, significantly. It is safe for humans (but will cause diarrhea in large amounts) but CAN kill your dog very quickly unless taken to the vet IMMEDIATELY. When 5mg per 1lb of body weight is ingested, it quickly causes liver failure followed by death and the effects will begin 10-15 minutes after ingesting. Any amount less than this can cause liver cirrhosis, seizures from severe hypoglycemia, tremors, and coma in under an hour. 

This sweetener is found in most “sugar free” snacks, gum, toothpaste, candies, and if you know anyone who follows a Keto Diet or is just simply diabetic, they most likely have a whole bag of the stuff in their cupboard because it tastes and bakes very similar to regular sugar. It’s even in some brands of peanut butter. With the holidays going on and everyone baking sweet treats, I thought I would mention this because until my own dog ate toothpaste with Xylitol, I had NO idea it was so dangerous. She’s fine, now. Thankfully she threw the majority of it up herself. It’s extremely easy for a pup to eat this amount of Xylitol. If you bake a sugar free cake and your dog eats it off the counter while it’s cooling, or you forget to put your toothpaste in the drawer and your curious puppy eats it like puppies do… you could have your heart broken in under an hour. So please be careful! Also never give your pup a homemade treat that you didn’t make yourself!! This info is not well known at all and a good-intending person may use xylitol in place of sugar to make the treats “healthier”. So just be careful, fellow pet owners :) 


Here is some more info! 

https://vcahospitals.com/know-your-pet/xylitol-toxicity-in-dogs"
1206,"YSK ""I don't know enough to have an opinion about it"" is a perfectly valid response.",YouShouldKnow,[removed]
1207,YSK: How to get a good night's sleep without melatonin,YouShouldKnow,[removed]
1208,YSK that you really don’t need porn to masturbate,YouShouldKnow,"Why YSK: It feels way better. A lot of people would prefer if porn wasn’t as big a part of their lives, possibly yourself included. But stopping yourself from masturbating is hard and I don’t think it’s healthy to stop. Instead of trying to reduce masturbating and porn together, just do it without porn, and you’ll be much better.

I used to feel mildly shitty about porn and masturbation, but recently i began simply masturbating without it, and let me tell you I feel great. I enjoy myself more while doing it, feel less gross, and I have realized that I don’t even like pornography. I also only do it when i’m actually horny now. It makes me feel alive and happy and attracted to my partner instead of kinda meh."
1209,YSK: Tortillas are NOT fully cooked yet,YouShouldKnow,"TL;DR: Tortillas fresh out of a bag/package are not fully cooked. Heating them on a hot non-stick, flattop, plancha, or well seasoned cast iron pan for 30 seconds to a minute on each side until light browning and warm/hot is essential for enjoying the tortillas. Store in a clean folded towel or aluminum foil after cooking before eating to retain heat/moisture.

After moving from a town in the southwest United States to a more northern, college town it has become abundantly, even PAINFULLY clear that this is not common knowledge. After seeing scores of undergrads, graduate students and grown people alike reaching their clueless hands towards a half cooked, chewy bitter tortilla for their burrito/taco/etc needs, I have elected to take a stand.

Why YSK: Tortillas are not fully cooked. Corn, Flour, or any other grain that has been wrangled into a circular shape under the name of tortillas do not come fully cooked. If they had been fully cooked prior to being packaged, they would be stiff, crunchy and frankly some unholy center point between a tortilla chip and a malleable, fresh tortilla. Thus the onus falls on you, the consumer to bring these glorious circles of flavor up to the correct temperature, finish the cooking/rising, and bring a bitter/raw flavor of uncooked corn and flour to their glorious savory and delicious conclusion.

How: The best and most traditional way would be a 'plancha' (think: a flat top griddle that gets exceptionally hot), but a non-stick pan or well seasoned cast-iron pan will do the job just as well. Get your choice of heat delivery device rippin' hot (mid-high) and start dropping tortillas. Times will vary based on heat of your burners, type of pan etc, but you should look for some light to medium browning and spots on each side. Tortillas are cheap! Try a few different levels of done-ness to see how you like them.

NOTE: Huge bonus points to use your fingers when grabbing a flipping tortillas. You will make a Mexican/South American grandmother very happy somewhere. The technique varies from surface to surface, but my preferred way is a light pinch to flip, or using the curved edge of the pan and my four fingers to draw it up, allowing my thumb to get under the tortilla and toss it down on the other side. Obviously, don't do anything you are not comfortable with, and this technique benefits from both speed and the presence of ""kitchen fingers"" (Where my food service people at?). This saves scratches on a pan, and is much faster/efficient than some metal tool or spatula.

As soon as the tortilla leaves the griddle, you should be tossing it somewhere that helps it retain its heat and moisture. My personal favorite is making a small foil pouch, pinched on 3 sides with a fold on the forth, that can perfectly be sealed and unsealed as I build a stack of hot and steamy tortillas inside. The same technique can be done with a clean, folded towel. This steam is part of the cooking process, it softens to tortillas up a bit, and helps retain moisture, and finishes the cooking process with the heat. (In fact this is a great technique for many other foods. ever wonder why ballpark hotdogs, wrapped burritos, wrapped burgers taste so good? Part of that process is letting the heat from the steam and meat flow into the bread and keep it warm and moist. A good technique for other items too!)

Take these tortillas out as you are ready to eat them.

BONUS:

carniceria/tortilleria : While most places may not have access to one of these stores, it is worth a quick map search. Tortillas from actual Latino/Hispanic grocers are much better than anything from a grocery store. Same rules apply for finishing cooking these tortillas. Plus, you will be supporting small businesses! These stores additionally often have a plethora of other Latin/Hispanic ingredients, seasonings, meats, pastries etc. and are often cheaper than chain grocery store equivalents (and better tasting!). Be kind and respectful of culture and language here too. I have never had a negative experience even though my Spanish is 'mierda', and the same service industry rules apply here: Hardworking people deserve respect and empathy, so don't be an asshole. Should go without saying, but still."
1210,YSK: Tortillas are NOT fully cooked yet,YouShouldKnow,[removed]
1211,YSK: There's a free and easy way to automate routine office tasks.,YouShouldKnow,"Why YSK: Nearly every office I've ever been in has done so many boring, repetitive things by hand. Spending just a couple of days learning the basics of a scripting language like Python can cut hours of tedious work out of your routine. Computers are really good at monotonous things, so if there's something you do the exact same way every day at work, there's probably a decent way to automate it.

A good resource for this is [Automate the Boring Stuff with Python](https://automatetheboringstuff.com/) by Al Sweigart. It's free to read online."
1212,YSK: driving slow isn't always the same as driving safe,YouShouldKnow,"Why YSK: there are a lot of situations where driving fast is safer than driving slow. 

For example if you're passing something, especially something like a truck with high winds, it's safest to pass it as quickly as possible. I always use the rule of thumb that passing should take 10 seconds maximum.

Another example is with weather that causes bad sight (think heavy fog or rain) a lot of people just slam their brakes. But it's way safer to just keep driving the recommended speed, since that makes you predictable. If you don't trust the poor vision, go to the right lane and gradually lower your speed, if you plan to go slower than 80 km/h on the highway turn on your hazards.

Read the situation on the road, sometimes speeding up/not slowing down is the right course of action. (Note: read sometimes. Don't go blasting 200 on the daily just because of this post)"
1213,YSK asking people out almost never actually makes them dislike you,YouShouldKnow,[removed]
1214,"YSK: When frustrated with a company, instead of telling the CSR ""YOU did XYZ bad thing to me,"" say ""COMPANY did XYZ bad thing to me.""",YouShouldKnow,"Why YSK: CSRs have an unbelievably difficult job. Framing your frustration as being the fault of the company, and not the CSR personally is not only the kind thing to do, it also increases the odds that the rep will go above and beyond to help you since you are not being unduly adversarial."
1215,YSK - Conflict of Interest with Human Resouces?,YouShouldKnow,"Why YSK: Conflict of interest, especially in a small organization may be confusing.

My colleagues and I were bouncing around a discussion. We are a small company - about 40 people. We have a single HR person. One of the many committees that this HR person sits on is a ""Project Prioritization Management Committee"". Basically, it's a committee to make sure that one of the departments is keeping up with their projects. I raised the question that I think it is a conflict of interest - especially considering the fact that the department's annual reviews, etc. are dependent on some of these projects. I know technically this could be a legal question, but in reality, to me, it's more of an ethical question.

Am I wrong in thinking that the HR person should not be on this committee?"
1216,YSK Human resources conflict of interest?,YouShouldKnow,[removed]
1217,"YSK: If you have a CareerBuilder account, even if old and disused, they have started applying for jobs on your behalf even when not relevant.",YouShouldKnow,"I started getting emails thanking me for my application to jobs I don’t want and am not qualified for recently. One of the recruiters was kind enough to respond to my follow up and informed me:

&gt;	Thank you for Emailing me about this. I received an application through Career Builder for a Truck Driver/Warehouse position yesterday. I spoke with the manager of my company and she advised me that if your resume and information is on CareerBuilder; CareerBuilder will apply on behalf of the candidate. I greatly apologize for the mix up and inconvenience.  I have deleted your information and you will no longer be contacted by our staffing company.

Why YSK: If you have received similar notifications, you did not have your identity compromised, apparently CareerBuilder is just resorting to desperate measures to increase their numbers. Time to delete!"
1218,"YSK if you have a CareerBuilder account, even if old and disused, they have started applying to jobs for you.",YouShouldKnow,[removed]
1219,"YSK: if you are using cold therapies such as ice baths or cold showers you still need to take a hot shower regularly for skin health, mental health, and hygiene.",YouShouldKnow,[removed]
1220,YSK: You can use a chrome extension to bring back the Youtube dislike button,YouShouldKnow,[removed]
1221,"YSK starting a workout regimen requires more mental gymnastics than physical. You need to establish mental structure to stay motivated and push through the drone of doing it every week of every year, forever.",YouShouldKnow,[removed]
1222,"YSK starting a workout regimen requires more mental gymnastics than physical. You need to establish mental structure to stay motivated and push through the drone of doing it every week of every year, forever.",YouShouldKnow,[removed]
1223,YSK: I fucked your mom,YouShouldKnow,[removed]
1224,"YSK: when you buy digital media online, you don't own it, you're just licensed to watch it. that can be taken away.",YouShouldKnow,"Why YSK: just because you ""buy"" something digitally, doesn't mean the same when you physically buy something. you are buying ACCESS to the content. don't be surprised if the company revokes access. 

[A user lost access to his movies in apple's ecosystem](https://www.forbes.com/sites/johnarcher/2018/09/17/apple-responds-to-disappearing-itunes-movie-purchases-issue/1). it was a [licensing issue](https://www.macobserver.com/analysis/apple-isnt-deleting-itunes-movies/)



If you look at amazon's policy for the content providers that want to use Amazon's platform: https://videodirect.amazon.com/home/agreement?ref_=avd_hm_ft_la

Under Section ""6. General Description of the Service; Distribution Modes:""
&gt;(a) **purchase a license to access** digital copies ...
 
&gt;(b) **purchase a license to access** digital copies ...

&gt;(c) **access** audio visual content via ...

&gt;(d) **access** audio visual content ....

Nowhere does it mention you own a copy of the audio/visual content. [A lawsuit against Apple for using ""buying"" when you don't really buy anything](https://screencrush.com/do-you-own-movies-you-buy-in-itunes-forever/)
&gt; ""Apple tried to get the lawsuit dismissed, claiming that consumers know that buying something on iTunes doesn’t mean buying it forever.""

[You don't own games from EA, only a license to the content](https://tos.ea.com/legalapp/WEBTERMS/US/en/PC/#section2)
&gt; **The EA Services are licensed to you, not sold**. EA grants you a personal, limited, non-transferable, revocable and non-exclusive license to use the EA Services to which you have access for your non-commercial use, subject to your compliance with this Agreement."
1225,YSK: Macbook pros don’t have any kind of power surge protection,YouShouldKnow,[removed]
1226,"YSK: There is something called the Iron Pipeline, a span of interstate that traffickers use to move weapons from states with weak laws to states with strong ones.",YouShouldKnow,[removed]
1227,YSK that button batteries (the batteries that look like coins) of swallowed can burn the inside of a persons esophagus and is a life threatening emergency.,YouShouldKnow,[removed]
1228,YSK: Allstate is buying your resume info to sell stuff.,YouShouldKnow,[removed]
1229,YSK: Allstate is buying your data.,YouShouldKnow,[removed]
1230,"Ysk . Free stock just for signing up, and you can sell it as soon as you want to and use money from the sale to buy cryptocurrency or just withdraw it and you have some cash for nothing.",YouShouldKnow,[removed]
